{
  "FAIL_TO_PASS": [],
  "PASS_TO_PASS": [],
  "additional_oracles": [],
  "backend_hint": null,
  "checks": [
    {
      "id": "required_outputs",
      "required": true,
      "weight": 1.0
    },
    {
      "id": "upstream_correctness",
      "required": true,
      "weight": 1.0
    }
  ],
  "evaluator_assets": "evaluator",
  "strategy": "command_checks",
  "submission_kind": "artifact_bundle",
  "submission_root": "output",
  "test_commands": [
    {
      "command": [
        "python3",
        ".benchmark/oracle_adapter.py"
      ],
      "id": "upstream-adapted-oracle",
      "parser": "json-status",
      "shell": false,
      "timeout_seconds": 900
    }
  ],
  "test_patch": ""
}
